{
  "schemaVersion": 1,
  "author": "codex",
  "day": 1,
  "range": "21-30",
  "set": 3,
  "items": [
    {
      "wordId": "DAY01-21",
      "no": 21,
      "word": "receipt",
      "sentence": "The clerk handed a long receipt to the happy shopper."
    },
    {
      "wordId": "DAY01-22",
      "no": 22,
      "word": "bitter",
      "sentence": "The small bear frowned at the bitter green tea leaves."
    },
    {
      "wordId": "DAY01-23",
      "no": 23,
      "word": "appearance",
      "sentence": "The young dog changed its appearance with a colorful party hat."
    },
    {
      "wordId": "DAY01-24",
      "no": 24,
      "word": "iron",
      "sentence": "Heat from the iron moves into cloth and smooths wrinkles."
    },
    {
      "wordId": "DAY01-25",
      "no": 25,
      "word": "palm",
      "sentence": "A small bird sat safely on the boy's open palm."
    },
    {
      "wordId": "DAY01-26",
      "no": 26,
      "word": "fancy",
      "sentence": "Today, the mouse wore a fancy hat covered in silver ribbons."
    },
    {
      "wordId": "DAY01-27",
      "no": 27,
      "word": "soak",
      "sentence": "A young cook let the beans soak inside a large bowl."
    },
    {
      "wordId": "DAY01-28",
      "no": 28,
      "word": "appeal",
      "sentence": "Colorful fruit bowls appeal to children choosing a healthy snack."
    },
    {
      "wordId": "DAY01-29",
      "no": 29,
      "word": "compare",
      "sentence": "Students compare two maps and explain their shared symbols."
    },
    {
      "wordId": "DAY01-30",
      "no": 30,
      "word": "compel",
      "sentence": "Today, the rules compel every player to move only one space."
    }
  ]
}
